{
  "spec_version": "0.1",
  "execution_id": "11111111-1111-4111-8111-111111111111",
  "trace_id": "trace-p06-negative-001",
  "role": "evidence.auditor",
  "capability": "gov.mx.evidence.verify_claim",
  "provider": {
    "provider_id": "adversarial-omission-test",
    "model_id": "synthetic-contradiction-omission-model",
    "adapter_version": "0.0.0-test"
  },
  "result": {
    "classification": "contradicted",
    "confidence": 0.94,
    "summary": "Salida sintética que declara contradicción pero omite el objeto de contradicciones.",
    "claims": [],
    "contradictions": [],
    "limitations": []
  },
  "governance": {
    "authority_scope": "advisory",
    "policy_version": "contextos.policy.evidence-auditor.v0.1",
    "canonical_mutation": false
  }
}
