{
  "spec_version": "0.1",
  "execution_id": "11111111-1111-4111-8111-111111111111",
  "trace_id": "trace-p06-negative-001",
  "role": "evidence.auditor",
  "capability": "gov.mx.evidence.verify_claim",
  "provider": {
    "provider_id": "synthetic-valid-provider",
    "model_id": "synthetic-valid-model",
    "adapter_version": "0.0.0-test"
  },
  "result": {
    "classification": "supported",
    "confidence": 0.9,
    "summary": "Salida sintética válida para comprobar que el validador no falla siempre.",
    "claims": [
      {
        "statement": "La evidencia sintética autorizada existe en el envelope.",
        "type": "fact",
        "source_evidence_ids": ["SRC-EVID-001"]
      }
    ],
    "contradictions": [],
    "limitations": []
  },
  "governance": {
    "authority_scope": "advisory",
    "policy_version": "contextos.policy.test.v0.1",
    "canonical_mutation": false
  }
}
